{
  "id": "DS-0001-coct-gv-roll-2022",
  "name": "City of Cape Town General Valuation Roll 2022",
  "description": "Official property valuation data for the City of Cape Town municipal area. Contains property boundaries, valuations, zoning, and ownership metadata.",
  "version": "v1.0.0",
  "source": {
    "type": "file",
    "url": "https://www.capetown.gov.za/general-valuation-2022",
    "access_method": "Public download from CoCT open data portal",
    "last_fetched": "2026-03-01T00:00:00Z"
  },
  "license": {
    "spdx_id": "CC-BY-4.0",
    "url": "https://creativecommons.org/licenses/by/4.0/",
    "commercial_use": true,
    "attribution_required": true,
    "share_alike": false,
    "notes": "City of Cape Town open data — attribution required"
  },
  "schema": {
    "format": "csv",
    "geometry_type": "Polygon",
    "fields": [
      { "name": "property_id", "type": "string", "description": "Unique property identifier" },
      { "name": "erf_number", "type": "string", "description": "ERF/cadastral number" },
      { "name": "suburb", "type": "string", "description": "Suburb name" },
      { "name": "market_value", "type": "number", "description": "Market value in ZAR" },
      { "name": "zoning", "type": "string", "description": "Zoning classification" },
      { "name": "extent_sqm", "type": "number", "description": "Property extent in square meters" }
    ]
  },
  "crs": "EPSG:4326",
  "spatial_extent": {
    "west": 18.3,
    "south": -34.4,
    "east": 18.9,
    "north": -33.7
  },
  "size": {
    "rows": 900000,
    "size_mb": 450,
    "partitions": 1
  },
  "privacy_sensitivity": "medium",
  "provenance": {
    "created_at": "2026-03-05T00:00:00Z",
    "created_by": "research-lab-init",
    "processing_steps": ["Downloaded from CoCT portal", "Converted to GeoJSON", "Reprojected to EPSG:4326"]
  },
  "quality": {
    "completeness": 0.95,
    "known_issues": ["Some rural properties missing geometry", "Valuations may not reflect 2026 market values"],
    "validation_status": "not_validated"
  }
}
