{
  "id": "DS-0002-osm-cape-town-buildings",
  "name": "OpenStreetMap Cape Town Building Footprints",
  "description": "Building footprint polygons extracted from OpenStreetMap for the Cape Town metropolitan area.",
  "version": "v1.0.0",
  "source": {
    "type": "api",
    "url": "https://overpass-api.de/api/interpreter",
    "access_method": "Overpass API query for building=* within Cape Town bbox",
    "last_fetched": "2026-03-05T00:00:00Z"
  },
  "license": {
    "spdx_id": "ODbL-1.0",
    "url": "https://opendatacommons.org/licenses/odbl/1-0/",
    "commercial_use": true,
    "attribution_required": true,
    "share_alike": true,
    "notes": "ODbL requires share-alike for derivative databases. Attribution: © OpenStreetMap contributors"
  },
  "schema": {
    "format": "geojson",
    "geometry_type": "Polygon",
    "fields": [
      { "name": "osm_id", "type": "string", "description": "OpenStreetMap feature ID" },
      { "name": "building", "type": "string", "description": "Building type tag" },
      { "name": "name", "type": "string", "description": "Building name (if tagged)" },
      { "name": "height", "type": "number", "description": "Building height in meters (if tagged)" },
      { "name": "levels", "type": "integer", "description": "Number of building levels (if tagged)" }
    ]
  },
  "crs": "EPSG:4326",
  "spatial_extent": {
    "west": 18.0,
    "south": -34.5,
    "east": 19.5,
    "north": -33.0
  },
  "size": {
    "rows": 350000,
    "size_mb": 120,
    "partitions": 1
  },
  "privacy_sensitivity": "public",
  "provenance": {
    "created_at": "2026-03-05T00:00:00Z",
    "created_by": "research-lab-init",
    "processing_steps": ["Extracted via Overpass API", "Filtered to Cape Town bbox", "Exported as GeoJSON"]
  },
  "quality": {
    "completeness": 0.7,
    "known_issues": ["Coverage varies by suburb — central areas well-mapped, informal settlements sparse", "Height data available for ~15% of buildings"],
    "validation_status": "not_validated"
  }
}
